{"meta":{"schema_version":"1.0.0","model_version":"0.0.0-mock","generated_at":"2026-09-18T20:09:00+00:00","valid_from":"2026-09-19","state":"karnataka","code_system":"mock","is_mock":true,"lead_dates":{"w1":{"start":"2026-09-20","end":"2026-09-26"},"w2":{"start":"2026-09-27","end":"2026-10-03"},"w3":{"start":"2026-10-04","end":"2026-10-10"},"w4":{"start":"2026-10-11","end":"2026-10-17"}}},"provenance":{"nwp":{"source":"ECMWF EC46 via Open-Meteo Seasonal API","members":51,"run_date":"2026-09-19"},"statistical":{"source":"LightGBM on IMD 0.25deg 1991-2024","seasons":34},"blend_weights":{"w1":0.8,"w2":0.6,"w3":0.4,"w4":0.25},"calibration":"isotonic, fitted on leave-one-year-out predictions"},"skill":{"bss":{"w1":0.21,"w2":0.12,"w3":0.03,"w4":-0.01},"reference":"per-cell, per-date climatology 1991-2024","roc_auc":0.74,"advisory_horizon_weeks":2},"areas":{"MOCK-BLK-Tumakuru":{"area_id":"MOCK-BLK-Tumakuru","name_en":"Tumakuru","level":"block","p_onset":{"w1":0.05,"w2":0.04,"w3":0.03,"w4":0.02},"p_false_onset":{"w1":0.1,"w2":0.08,"w3":0.06,"w4":0.05},"p_dry7":{"w1":0.32,"w2":0.41,"w3":0.48,"w4":0.55},"p_dry14":{"w1":0.12,"w2":0.19,"w3":0.26,"w4":0.31},"p_heavy":{"w1":0.18,"w2":0.12,"w3":0.09,"w4":0.07},"onset_status":"in_season","confidence":"medium","lgd_code":null,"parent_id":null,"name_kn":"ತುಮಕೂರು","district_en":"Tumakuru","centroid":[77.101,13.342],"n_cells":9,"onset_delay_weeks":2.0,"advisories":[{"rule_id":"tumakuru.groundnut.delayed_onset_4w","crop":"groundnut","stage":"pre_sowing","severity":"warn","action_en":"Switch from groundnut to horse gram or foxtail millet","action_kn":"ಶೇಂಗಾ ಬದಲು ಹುರುಳಿ ಅಥವಾ ನವಣೆ ಬಿತ್ತನೆ ಮಾಡಿ","confidence_word_en":"likely","confidence_word_kn":"ಸಾಧ್ಯತೆ ಹೆಚ್ಚು","source":{"doc":"ICAR-CRIDA district agriculture contingency plan","table":"2.1.1","district":"Tumakuru"}}]},"MOCK-BLK-Tiptur":{"area_id":"MOCK-BLK-Tiptur","name_en":"Tiptur","level":"block","p_onset":{"w1":0.052,"w2":0.042,"w3":0.03,"w4":0.02},"p_false_onset":{"w1":0.103,"w2":0.082,"w3":0.06,"w4":0.05},"p_dry7":{"w1":0.325,"w2":0.414,"w3":0.48,"w4":0.55},"p_dry14":{"w1":0.123,"w2":0.193,"w3":0.26,"w4":0.31},"p_heavy":{"w1":0.179,"w2":0.12,"w3":0.09,"w4":0.07},"onset_status":"in_season","confidence":"medium","lgd_code":null,"parent_id":null,"name_kn":"ತಿಪಟೂರು","district_en":"Tumakuru","centroid":[76.477,13.256],"n_cells":9,"onset_delay_weeks":2.1},"MOCK-BLK-Chitradurga":{"area_id":"MOCK-BLK-Chitradurga","name_en":"Chitradurga","level":"block","p_onset":{"w1":0.054,"w2":0.044,"w3":0.03,"w4":0.02},"p_false_onset":{"w1":0.106,"w2":0.084,"w3":0.06,"w4":0.05},"p_dry7":{"w1":0.33,"w2":0.418,"w3":0.48,"w4":0.55},"p_dry14":{"w1":0.126,"w2":0.196,"w3":0.26,"w4":0.31},"p_heavy":{"w1":0.178,"w2":0.12,"w3":0.09,"w4":0.07},"onset_status":"in_season","confidence":"medium","lgd_code":null,"parent_id":null,"name_kn":"ಚಿತ್ರದುರ್ಗ","district_en":"Chitradurga","centroid":[76.398,14.23],"n_cells":9,"onset_delay_weeks":2.2},"MOCK-BLK-Hiriyur":{"area_id":"MOCK-BLK-Hiriyur","name_en":"Hiriyur","level":"block","p_onset":{"w1":0.056,"w2":0.046,"w3":0.03,"w4":0.02},"p_false_onset":{"w1":0.109,"w2":0.086,"w3":0.06,"w4":0.05},"p_dry7":{"w1":0.335,"w2":0.422,"w3":0.48,"w4":0.55},"p_dry14":{"w1":0.129,"w2":0.199,"w3":0.26,"w4":0.31},"p_heavy":{"w1":0.177,"w2":0.12,"w3":0.09,"w4":0.07},"onset_status":"in_season","confidence":"medium","lgd_code":null,"parent_id":null,"name_kn":"ಹಿರಿಯೂರು","district_en":"Chitradurga","centroid":[76.619,13.945],"n_cells":9,"onset_delay_weeks":2.3},"MOCK-BLK-Chikkaballapur":{"area_id":"MOCK-BLK-Chikkaballapur","name_en":"Chikkaballapur","level":"block","p_onset":{"w1":0.058,"w2":0.048,"w3":0.03,"w4":0.02},"p_false_onset":{"w1":0.112,"w2":0.088,"w3":0.06,"w4":0.05},"p_dry7":{"w1":0.34,"w2":0.426,"w3":0.48,"w4":0.55},"p_dry14":{"w1":0.132,"w2":0.202,"w3":0.26,"w4":0.31},"p_heavy":{"w1":0.176,"w2":0.12,"w3":0.09,"w4":0.07},"onset_status":"in_season","confidence":"low","lgd_code":null,"parent_id":null,"name_kn":"ಚಿಕ್ಕಬಳ್ಳಾಪುರ","district_en":"Chikkaballapur","centroid":[77.732,13.435],"n_cells":9,"onset_delay_weeks":2.4},"MOCK-BLK-Davanagere":{"area_id":"MOCK-BLK-Davanagere","name_en":"Davanagere","level":"block","p_onset":{"w1":0.06,"w2":0.05,"w3":0.03,"w4":0.02},"p_false_onset":{"w1":0.115,"w2":0.09,"w3":0.06,"w4":0.05},"p_dry7":{"w1":0.345,"w2":0.43,"w3":0.48,"w4":0.55},"p_dry14":{"w1":0.135,"w2":0.205,"w3":0.26,"w4":0.31},"p_heavy":{"w1":0.175,"w2":0.12,"w3":0.09,"w4":0.07},"onset_status":"in_season","confidence":"low","lgd_code":null,"parent_id":null,"name_kn":"ದಾವಣಗೆರೆ","district_en":"Davanagere","centroid":[75.921,14.464],"n_cells":9,"onset_delay_weeks":2.5},"MOCK-BLK-Kolar":{"area_id":"MOCK-BLK-Kolar","name_en":"Kolar","level":"block","p_onset":{"w1":0.062,"w2":0.052,"w3":0.03,"w4":0.02},"p_false_onset":{"w1":0.118,"w2":0.092,"w3":0.06,"w4":0.05},"p_dry7":{"w1":0.35,"w2":0.434,"w3":0.48,"w4":0.55},"p_dry14":{"w1":0.138,"w2":0.208,"w3":0.26,"w4":0.31},"p_heavy":{"w1":0.174,"w2":0.12,"w3":0.09,"w4":0.07},"onset_status":"in_season","confidence":"low","lgd_code":null,"parent_id":null,"name_kn":"ಕೋಲಾರ","district_en":"Kolar","centroid":[78.13,13.137],"n_cells":9,"onset_delay_weeks":2.6},"MOCK-HOB-Gubbi":{"area_id":"MOCK-HOB-Gubbi","name_en":"Gubbi","level":"panchayat","p_onset":{"w1":0.064,"w2":0.054,"w3":0.03,"w4":0.02},"p_false_onset":{"w1":0.121,"w2":0.094,"w3":0.06,"w4":0.05},"p_dry7":{"w1":0.355,"w2":0.438,"w3":0.48,"w4":0.55},"p_dry14":{"w1":0.141,"w2":0.211,"w3":0.26,"w4":0.31},"p_heavy":{"w1":0.173,"w2":0.12,"w3":0.09,"w4":0.07},"onset_status":"in_season","confidence":"low","lgd_code":null,"parent_id":"MOCK-BLK-Tumakuru","name_kn":"ಗುಬ್ಬಿ","district_en":"Tumakuru","centroid":[76.94,13.312],"n_cells":3,"onset_delay_weeks":2.7},"MOCK-HOB-Kora":{"area_id":"MOCK-HOB-Kora","name_en":"Kora","level":"panchayat","p_onset":{"w1":0.066,"w2":0.056,"w3":0.03,"w4":0.02},"p_false_onset":{"w1":0.124,"w2":0.096,"w3":0.06,"w4":0.05},"p_dry7":{"w1":0.36,"w2":0.442,"w3":0.48,"w4":0.55},"p_dry14":{"w1":0.144,"w2":0.214,"w3":0.26,"w4":0.31},"p_heavy":{"w1":0.172,"w2":0.12,"w3":0.09,"w4":0.07},"onset_status":"in_season","confidence":"low","lgd_code":null,"parent_id":"MOCK-BLK-Tumakuru","name_kn":"ಕೋರ","district_en":"Tumakuru","centroid":[77.043,13.443],"n_cells":3,"onset_delay_weeks":2.8}}}